{
  "doc_id": "electrical_spec_luch",
  "source_url": "https://xn--b1agbeeum4cvb8b.xn--p1ai/upload/iblock/e9f/e9f9b15b6d103acbeee110b6106ee9a8.pdf",
  "source_type": "synthetic",
  "description": "Раздел ИОС1.1 (электрооборудование и электроосвещение) жилого дома с детским садом, мкр Западный Луч, Челябинск. Шифр 269-ЕП-2018. Обрезан до 17 страниц (пояснительная записка). Инжектированы ошибки E04 и E05.",
  "pages_total": 17,
  "expected_parameters": [
    {
      "name": "Тип кабеля распределительных сетей жилого дома",
      "value": "ВВГнг(А)-LS",
      "unit": "",
      "context": "линии систем рабочего освещения, силовых электроприемников, систем вентиляции жилого дома",
      "source_page": 14,
      "source_text_hint": "кабелями ВВГнг(А)-LS (силовые кабели с медными жилами"
    },
    {
      "name": "Тип кабеля 1-й категории жилого дома",
      "value": "ВВГнг(А)-FRLS",
      "unit": "",
      "context": "линии систем аварийного освещения, противопожарной защиты, питания лифтов",
      "source_page": 14,
      "source_text_hint": "кабелями ВВГнг(А)-FRLS (силовые кабели с медными жилами"
    },
    {
      "name": "Тип кабеля распределительных сетей детского сада",
      "value": "АВВГнг(А)-LSLTx",
      "unit": "",
      "context": "линии систем рабочего освещения, силовых электроприемников систем вентиляции, теплоснабжения и водоснабжения детского сада",
      "source_page": 15,
      "source_text_hint": "АВВГнг(А)-LSLTx (силовые кабели с алюминиевыми жилами"
    },
    {
      "name": "Тип кабеля 1-й категории детского сада",
      "value": "ВВГнг(А)-FRLSLTx",
      "unit": "",
      "context": "линии систем аварийного освещения, противопожарной защиты детского сада",
      "source_page": 15,
      "source_text_hint": "кабелями ВВГнг(А)- FRLSLTx (силовые кабели с медными жилами"
    },
    {
      "name": "Сечение PE-проводника уравнивания потенциалов",
      "value": "1.5",
      "unit": "мм²",
      "context": "проводка от коробки КРЗ (шина дополнительного уравнивания потенциалов) в санузле и помещении хранения уборочного инвентаря",
      "source_page": 14,
      "source_text_hint": "ПВ3нг-1х1.5 мм.кв"
    },
    {
      "name": "Система заземления",
      "value": "TN-C-S",
      "unit": "",
      "context": "система заземления электроустановок здания",
      "source_page": 13,
      "source_text_hint": "Система заземления электроустановок здания TN-C-S"
    }
  ],
  "expected_violations": [
    {
      "parameter_name": "Тип кабеля распределительных сетей детского сада",
      "actual": "АВВГнг(А)-LSLTx (кабель с алюминиевыми жилами)",
      "required": "Кабель с медными жилами (ВВГнг или аналог) для внутренней электропроводки жилых и общественных зданий",
      "norm_doc": "ПУЭ 7-е изд.",
      "norm_section": "7.1.34",
      "severity": "critical",
      "note": "catalog_id: E04. В здании с детским садом применён кабель с алюминиевыми жилами (АВВГнг) вместо медных (ВВГнг). ПУЭ 7.1.34 требует применения кабелей с медными жилами для внутренней электропроводки жилых и общественных зданий."
    },
    {
      "parameter_name": "Сечение PE-проводника уравнивания потенциалов",
      "actual": "1.5 мм²",
      "required": "≥ 2.5 мм² (при наличии механической защиты) или ≥ 4 мм² (без механической защиты)",
      "norm_doc": "ПУЭ 7-е изд.",
      "norm_section": "1.7.126",
      "severity": "major",
      "note": "catalog_id: E05. Сечение PE-проводника дополнительной системы уравнивания потенциалов (ПВ3нг-1х1.5) меньше минимально допустимого по ПУЭ 1.7.126."
    }
  ],
  "expected_normatives": [
    "ПУЭ 7-е изд."
  ]
}
