{
  "doc_id": "ventilation_fosfokhim",
  "source_url": "https://tgl.ru/files/tinymce/razdel-pd-5-podrazdel-pd-4-ios.ov-sistema-otopleniya-ventilyacii-i-kondicionirovaniya_file_1648116581.pdf",
  "source_type": "synthetic",
  "description": "Раздел ИОС4.1 (отопление, вентиляция и кондиционирование) цеха по производству медных анодов ЗАО «ФОСФОХИМ», г. Тольятти. Обрезан до 49 страниц. Инжектированы ошибки V04 (занижены нормы воздухообмена санузлов).",
  "pages_total": 49,
  "expected_parameters": [
    {
      "name": "Расход воздуха на удаление из санузла (на 1 унитаз)",
      "value": "25",
      "unit": "м³/ч",
      "context": "воздухообмен в санузлах цеха по производству медных анодов",
      "source_page": 15,
      "source_text_hint": "удаления 25м3/час воздуха на 1 уни"
    },
    {
      "name": "Расход воздуха на удаление из санузла (на 1 писсуар)",
      "value": "15",
      "unit": "м³/ч",
      "context": "воздухообмен в санузлах цеха по производству медных анодов",
      "source_page": 15,
      "source_text_hint": "15 м3/час воздуха на 1 писсуар"
    },
    {
      "name": "Расход воздуха приточной системы П1",
      "value": "30000",
      "unit": "м³/ч",
      "context": "дежурное отопление производственного корпуса, холодный период",
      "source_page": 13,
      "source_text_hint": "П1 ( с частотником L=30000 м3/час"
    },
    {
      "name": "Расход воздуха приточной системы П2",
      "value": "15000",
      "unit": "м³/ч",
      "context": "дежурное отопление производственного корпуса, холодный период",
      "source_page": 13,
      "source_text_hint": "П2 ( с частотником L=15000"
    },
    {
      "name": "Расход воздуха вытяжной системы В1 (режим восстановления, теплый период)",
      "value": "15964",
      "unit": "м³/ч",
      "context": "режим восстановления на плавильно-разливочном участке",
      "source_page": 14,
      "source_text_hint": "В1 и В2 (с частотником L=15964 м3/час каждая"
    },
    {
      "name": "Производительность чиллеров (холодоснабжение)",
      "value": "1060",
      "unit": "кВт",
      "context": "источник холодоснабжения цеха",
      "source_page": 16,
      "source_text_hint": "2 чиллера суммарной производительностью 1060"
    }
  ],
  "expected_violations": [
    {
      "parameter_name": "Расход воздуха на удаление из санузла (на 1 унитаз)",
      "actual": "25 м³/ч на 1 унитаз",
      "required": "≥ 50 м³/ч на 1 унитаз",
      "norm_doc": "СП 60.13330.2020",
      "norm_section": "Таблица 7.2 (приложение), СанПиН 1.2.3685-21 табл. 5.34",
      "severity": "major",
      "note": "catalog_id: V04. Расход вытяжного воздуха на 1 унитаз (25 м³/ч) в 2 раза ниже нормативного (50 м³/ч). Нарушена минимальная кратность воздухообмена для санитарных узлов."
    },
    {
      "parameter_name": "Расход воздуха на удаление из санузла (на 1 писсуар)",
      "actual": "15 м³/ч на 1 писсуар",
      "required": "≥ 25 м³/ч на 1 писсуар",
      "norm_doc": "СП 60.13330.2020",
      "norm_section": "Таблица 7.2 (приложение), СанПиН 1.2.3685-21 табл. 5.34",
      "severity": "major",
      "note": "catalog_id: V04. Расход вытяжного воздуха на 1 писсуар (15 м³/ч) ниже нормативного (25 м³/ч)."
    }
  ],
  "expected_normatives": [
    "СП 60.13330.2020",
    "СанПиН 1.2.3685-21"
  ]
}
